{
  "id": "cc.narrative-architectures.narrative-capsule-composer.local-manifest.v0.1",
  "title": "Narrative Capsule Composer — Context Canvas Projection",
  "version": "0.1",
  "created": "2026-08-19",
  "sourceAuthority": {
    "contractOwner": "@driftframe/narrative-architecture",
    "implementationOwner": "Context Canvas",
    "relationship": "context_canvas_owned_projection"
  },
  "pathContract": {
    "sourcePath": "manifest-directory",
    "localPath": "repository-root",
    "entryFile": "localPath",
    "sourceManifest": "localPath",
    "usedByPages": "manifest-directory"
  },
  "publicationPosture": "visitor-linked-through-receiving-pages",
  "archive": {"status": "rebuilt-local-snapshot", "path": "narrative-capsules-chimeric-prototype-bundle-v0.1.zip"},
  "integrity": {"algorithm": "sha256", "entryFile": "74d0859c33d2e671a3b27d2bd893fbd6a2a04bb7274281168a49608484a80525"},
  "canonicalStatus": "context_canvas_owned_projection",
  "sourcePath": ".",
  "localPath": "context-canvas-project-surface/context-canvas/prototypes/narrative-architectures/narrative-capsule-composer/",
  "entryFile": "narrative-capsules-chimeric-prototype-v0.1.html",
  "sourceManifest": "narrative-capsules-chimeric-prototype-manifest-v0.1.json",
  "localAdaptations": [
    "The manifest-current Core Architecture Family Index is adapted into companions/ so the capsule link remains child-directory relative.",
    "Strategy Canvas registry, manifest, and prototype references resolve through Context-local routes.",
    "The published Strategy Canvas schema validator establishes the source contract before adapter mapping.",
    "Prompt Capsule 0.1.0 projects role-aware plain and skill-assisted GitHub Flavored Markdown, complete Strategy Canvas dimension meaning, a shared state-only fingerprint, two related loops, and exact visible, copy, download, and API bytes.",
    "The deterministic local bundle rewrites repository-relative Strategy Canvas routes to its included portable companions and verifies the local links in the included Strategy Canvas."
  ],
  "divergence": {
    "status": "context_canvas_owned_projection",
    "changedPaths": [
      "companions/",
      "core-architecture-target-pair-registry.v0.1.json",
      "narrative-capsule-composition.example.invalid.v0.1.json",
      "narrative-capsule-composition.example.valid.v0.1.json",
      "narrative-capsules-chimeric-prototype-manifest-v0.1.json",
      "narrative-capsules-chimeric-prototype-v0.1.html",
      "narrative-capsules-composition-addendum-v0.1.md",
      "narrative-capsules-prototype-profile-v0.1.yaml",
      "narrative-capsules-chimeric-prototype-bundle-v0.1.zip"
    ]
  },
  "usedByPages": [
    "../../../ai-systems.html"
  ]
}
